{
  "schema": "issue-orchestration.control-plane-advisor-policy.v1",
  "version": "bounded-control-plane-advisor.v1",
  "serviceActorId": "control-plane-advisor",
  "productDeliveryRole": false,
  "executionClass": "observe-only",
  "freshContext": true,
  "outputAuthority": "proposal-only",
  "stateAuthority": "none",
  "remoteAuthority": "none",
  "capabilityClass": "frontier-control-plane-advisor",
  "selectionAuthority": "canonical-route-cell-compiler",
  "routeCellId": "control.unknown-complex-advisor",
  "requiredProfile": "sol-max",
  "reviewedAssumptionDigest": "eadd89e892b472fc56827d455fc0d1b5f21fc4ad4dfc6a399c84e91c37082681",
  "profileSearchForbidden": true,
  "allowedFailureDomain": "orchestration-control-plane",
  "maxAffectedTargets": 32,
  "maxDiagnosticQuestions": 16,
  "maxActions": 16,
  "consultationsPerFailureDigest": 1,
  "allowedRecommendationKinds": [
    "bounded-recovery",
    "human-required",
    "recovery-takeover-required",
    "terminalize"
  ],
  "actionVocabulary": {
    "freeze-member": "machine-member-freezer",
    "cancel-attempt": "machine-attempt-canceller",
    "quarantine-resource": "machine-resource-quarantine",
    "release-lease-after-cleanup": "machine-lease-registry",
    "invalidate-receipt": "machine-receipt-invalidator",
    "refresh-remote-snapshot": "trusted-remote-observer",
    "rebuild-member-projection": "machine-runtime-projector",
    "recompile-route": "canonical-route-cell-compiler",
    "rebuild-continuation": "machine-continuation-compiler",
    "resume-from-checkpoint": "machine-continuation-controller",
    "terminalize-member": "machine-terminal-controller",
    "terminalize-run": "machine-terminal-controller",
    "request-human-decision": "machine-human-decision-gate",
    "request-root-takeover": "machine-takeover-policy"
  },
  "forbiddenActions": [
    "arbitrary-command",
    "shell-command",
    "free-form-file-edit",
    "dag-rewrite",
    "force-remote-mutation",
    "ignore-receipt",
    "bypass-breaker",
    "bypass-acceptance",
    "bypass-verification",
    "bypass-landing",
    "bypass-delivery",
    "bypass-human-decision"
  ],
  "mandatoryRevalidationGates": [
    "breaker",
    "acceptance",
    "independent-verification",
    "landing",
    "delivery",
    "remote-mutation",
    "mutation-postcondition"
  ],
  "unboundedRequestFields": [
    "credentials",
    "tokens",
    "secrets",
    "writableStateRootPath",
    "fullConversationHistory",
    "unrelatedIssueHistory",
    "preferredRecoveryConclusion",
    "fullRepositoryDump",
    "fullDag"
  ],
  "rootProfile": "terra-low",
  "rootMayEditPlan": false,
  "unaffectedWorkMayContinue": true
}
